{
  "schema_version": 1,
  "event_id": "20260923T190000Z-0000000b",
  "at": "2026-09-23T19:00:00Z",
  "tool": "cloudify",
  "tool_version": "t",
  "writer": {
    "kind": "operator",
    "name": "rachid"
  },
  "run_id": null,
  "step_id": "adopt",
  "application": "affine",
  "flavor": "default",
  "deployment": "main",
  "application_commit": null,
  "subject": {
    "kind": "package",
    "host": "cloudai:affine",
    "host_key": "ivps:cloudai:affine",
    "package": "affine",
    "package_instance": "default"
  },
  "phase": null,
  "command_kind": "adopt",
  "values": {
    "AFFINE_PORT": "8787"
  },
  "outcome": {
    "exit_status": 0,
    "summary": "adopted from observation: server verified on :8787, values recorded as recipe defaults"
  },
  "state": {
    "previous_revision": 0,
    "resulting_revision": 1
  },
  "development_override": true
}
