{
  "schema_version": 1,
  "event_id": "20260101T110000Z-9a0b1c2d",
  "at": "2026-01-01T11:00:00Z",
  "tool": "cloudify",
  "writer": {
    "host": "cloudai",
    "boot_id": "3f2a1b0c-4d5e-6f70-8192-a3b4c5d6e7f8",
    "pid": 48213,
    "process_start_ticks": 91726345
  },
  "run_id": "20260101T110000Z-6b7c8d9e",
  "step_id": "teardown-unexpose",
  "application": "xfce-guacamole",
  "flavor": "disposable",
  "deployment": "default",
  "application_commit": "0f1e2d3c4b5a69788796a5b4c3d2e1f009182736",
  "subject": {
    "kind": "deployment",
    "host": null,
    "host_key": null,
    "package": null,
    "package_instance": null
  },
  "phase": "teardown",
  "command_kind": "run",
  "values": {},
  "outcome": {
    "exit_status": 0,
    "summary": "exposure record retained for operator review"
  },
  "state": {
    "previous_revision": null,
    "resulting_revision": null
  },
  "tool_version": "1.0.0"
}
