{
  "schema_version": 1,
  "event_id": "20260101T101112Z-a1b2c3d4",
  "at": "2026-01-01T10:11:12Z",
  "tool": "cloudify",
  "writer": {
    "host": "cloudai",
    "boot_id": "3f2a1b0c-4d5e-6f70-8192-a3b4c5d6e7f8",
    "pid": 48213,
    "process_start_ticks": 91726345
  },
  "run_id": "20260101T101112Z-a1b2c3d4",
  "step_id": "install-guacamole",
  "application": "xfce-guacamole",
  "flavor": "disposable",
  "deployment": "default",
  "application_commit": "0f1e2d3c4b5a69788796a5b4c3d2e1f009182736",
  "subject": {
    "kind": "package",
    "host": "cloudai:cloudify",
    "host_key": "ivps:cloudai:cloudify",
    "package": "guacamole",
    "package_instance": "default"
  },
  "phase": "install",
  "command_kind": "install",
  "values": {
    "CLOUDIFY_GUACAMOLE_RDP_HOST": "value-of-none",
    "CLOUDIFY_GUACAMOLE_RDP_PASSWORD": "****"
  },
  "outcome": {
    "exit_status": 0,
    "summary": "install succeeded"
  },
  "state": {
    "previous_revision": 0,
    "resulting_revision": 1
  },
  "log_reference": {
    "path": "/tmp/cloudify/logs/20260101T101112Z.log",
    "sha256": "45ffa9414b900d7b45cfe5d4df258d9d8ac75122da0fcd323fd6bab233248dee"
  },
  "tool_version": "1.0.0"
}
